{
  "countersign": "0.1",
  "intent_id": "7594b06a-3c5a-43b8-a014-7c7519f197e8",
  "decision": "approve",
  "actor": "telegram:8675309",
  "policy": "approver",
  "timestamp": "2026-07-07T12:43:42.898Z",
  "public_key": "SMhHxXO9ai4BwhtvFM7hr3MlJ8zb6ZXoaEhQRef2qXw",
  "signature": "kkNHfrtCg47NY13OC9-cP9nITHQJlpqQxSbBhK1FAKjFJCXQCYX2gejwOGvdFxvwJQ_fEzHf-jKkKI3X5859Cw"
}
